{
  "operation_contract_version": "2.0",
  "operation_id": "op_bbbbbbbbbbbbbbbbbbbbbbbbbb",
  "idempotency_token": "idem_bbbbbbbbbbbbbbbbbbbbbbbb",
  "phase": "operate",
  "profile": "gamelift.capacity-adjustment/2.0",
  "action": "gamelift.adjust-fleet-capacity",
  "provider": "gamelift",
  "created_at": "2026-09-21T19:11:52Z",
  "decision_expires_at": "2026-09-21T19:13:52Z",
  "playbook": {
    "playbook_id": "playbook.gamelift-capacity-autonomy",
    "playbook_version": "2.0.0",
    "playbook_hash": "sha256:1aad3dc54c42e729e27cab78394ad17fc44d397e58ba20521a470890431b19c1"
  },
  "capability": {
    "capability_id": "gamelift.capacity-adjustment",
    "capability_version": "2.0"
  },
  "automation_principal": {
    "source_type": "automation",
    "subject_id": "subject.autonomy-agent",
    "client_id": "client.autonomy-runtime",
    "tenant_id": "tenant.default",
    "workspace_id": "workspace.default"
  },
  "correlation": {
    "correlation_id": "corr.autonomy-1",
    "request_id": "request.autonomy-1"
  },
  "target": {
    "provider": "gamelift",
    "fleet_id": "fleet-1234abcd-5678-90ef-a1b2-c3d4e5f60789",
    "location": "us-west-2"
  },
  "parameters": {
    "requested": {
      "desired": 1,
      "minimum": 0,
      "maximum": 1
    },
    "change": {
      "desired": 1,
      "minimum": 0,
      "maximum": 0
    }
  },
  "current_state": {
    "observation_id": "obs_bbbbbbbbbbbbbbbbbbbbbbbbbb",
    "observation_hash": "sha256:0000000000000000000000000000000000000000000000000000000000000000",
    "capacity": {
      "desired": 0,
      "minimum": 0,
      "maximum": 1
    },
    "observed_at": "2026-09-21T19:11:52Z",
    "expires_at": "2026-09-21T19:13:52Z"
  },
  "resource_enrollment": {
    "enrollment_id": "enroll.fleet-default",
    "enrollment_version": "2026-09-01"
  },
  "autonomy_policy": {
    "policy_id": "policy.gamelift-capacity-autonomy",
    "policy_version": "2026-09-01",
    "policy_hash": "sha256:826c3fb781ca57b6e629d32a5cd091beddab786953d22f6247b8137498f953e9"
  },
  "decision": {
    "decision_id": "autz.op_bbbbbbbbbbbbbbbbbbbbbbbbbb",
    "decision_hash": "sha256:bdfc4554ac60ad14660089498ec634404b4431ae80d328f0fdd9dcbfd11e31ab"
  },
  "calculated_risk": {
    "level": "high",
    "score": 60,
    "factors": [
      "desired-magnitude",
      "scale-up"
    ]
  },
  "authority": {
    "authority_inputs": {
      "deployment_mode": "operate",
      "tenant_policy": "operate",
      "workspace_policy": "operate",
      "principal_authority": "operate",
      "capability_maximum": "operate",
      "operation_risk_policy": "operate"
    },
    "effective_authority": "operate",
    "decision": "authorized",
    "reason_codes": [
      "APPROVED_AUTONOMOUS"
    ]
  },
  "retry_policy": {
    "max_attempts": 3,
    "base_delay_seconds": 2,
    "max_delay_seconds": 60,
    "reconcile_before_retry": true
  },
  "executor_binding": {
    "executor_id": "executor.gamelift-capacity",
    "executor_binding_version": "1.0"
  },
  "required_execution_authority": "operate",
  "prepared_hash": "sha256:13bdcdb910a98b9c0edc50abbc9777086d07b4f4abcdf6b544836e0264b2a3c3"
}
